pubmed_id,abstract,gene_type
35649140,"Oxytocin (Oxt) is known to regulate social communication, stress and body weight. The activation of Oxt receptors (OTR) has clinical potential to abate stress disorders and metabolic syndrome. Kamikihito (KKT) is a traditional Japanese medicine used to treat psychological stress-related disorders. We investigated the effects of KKT, its ingredients and chemical components on Oxt neurons and OTR. C-Fos expression was examined after oral and peripheral administration of KKT in rats. Electrophysiological change of Oxt neurons and Oxt release upon application of KKT were measured in rat brain slice. The direct effect of KKT, its ingredients and its chemical components were examined by cytosolic Ca",GOF
35649192,"The treatment landscape for advanced hepatocellular carcinoma has changed dramatically over the past 4 years. We now have numerous options for patients in frontline, second-line, and beyond. The most significant impact has been the introduction of immunotherapy into our treatment paradigms. We now have regimens that induce consistent double-digit objective response rates and markedly improve overall survival (OS) with favorable side effect profiles. The combination of atezolizumab and bevacizumab has demonstrated that the combination of targeting programmed death-ligand 1 and the vascular endothelial growth factor axis can improve outcomes versus sorafenib in the IMBrave150 study. Results from the COSMIC-312 study evaluating the multikinase vascular endothelial growth factor receptor, hepatocyte growth factor receptor, and ",GOF
35649230,"Use of germline genetic testing among patients with cancer is increasing because of (1) the availability of multigene panel tests that include multiple cancer susceptibility genes in a single test, (2) decreased costs of these tests and improvements in insurance coverage, and (3) US Food and Drug Administration-approval of genotype-directed therapies such as poly(ADP-ribose) polymerase inhibitors for individuals with certain cancers and pathogenic germline variants in ",LOF
35649362,"The MDM2 oncoprotein antagonizes the tumor suppressor p53 by physical interaction and ubiquitination. However, it also sustains the progression of DNA replication forks, even in the absence of functional p53. Here, we show that MDM2 binds, inhibits, ubiquitinates, and destabilizes poly(ADP-ribose) polymerase 1 (PARP1). When cellular MDM2 levels are increased, this leads to accelerated progression of DNA replication forks, much like pharmacological inhibition of PARP1. Conversely, overexpressed PARP1 restores normal fork progression despite elevated MDM2. Strikingly, MDM2 profoundly reduces the frequency of fork reversal, revealed as four-way junctions through electron microscopy. Depletion of RECQ1 or the primase/polymerase (PRIMPOL) reverses the MDM2-mediated acceleration of the nascent DNA elongation rate. MDM2 also increases the occurrence of micronuclei, and it exacerbates camptothecin-induced cell death. In conclusion, high MDM2 levels phenocopy PARP inhibition in modulation of fork restart, representing a potential vulnerability of cancer cells.",GOF
35649376,"Endothelial and erythropoietic lineages arise from a common developmental progenitor. Etv2 is a master transcriptional regulator required for the development of both lineages. However, the mechanisms through which Etv2 initiates the gene-regulatory networks (GRNs) for endothelial and erythropoietic specification and how the two GRNs diverge downstream of Etv2 remain incompletely understood. Here, by analyzing a hypomorphic Etv2 mutant, we demonstrate different threshold requirements for initiation of the downstream GRNs for endothelial and erythropoietic development. We show that Etv2 functions directly in a coherent feedforward transcriptional network for vascular endothelial development, and a low level of Etv2 expression is sufficient to induce and sustain the endothelial GRN. In contrast, Etv2 induces the erythropoietic GRN indirectly via activation of Tal1, which requires a significantly higher threshold of Etv2 to initiate and sustain erythropoietic development. These results provide important mechanistic insight into the divergence of the endothelial and erythropoietic lineages.",GOF
35649412,"The factors driving therapy resistance in diffuse glioma remain poorly understood. To identify treatment-associated cellular and genetic changes, we analyzed RNA and/or DNA sequencing data from the temporally separated tumor pairs of 304 adult patients with isocitrate dehydrogenase (IDH)-wild-type and IDH-mutant glioma. Tumors recurred in distinct manners that were dependent on IDH mutation status and attributable to changes in histological feature composition, somatic alterations, and microenvironment interactions. Hypermutation and acquired CDKN2A deletions were associated with an increase in proliferating neoplastic cells at recurrence in both glioma subtypes, reflecting active tumor growth. IDH-wild-type tumors were more invasive at recurrence, and their neoplastic cells exhibited increased expression of neuronal signaling programs that reflected a possible role for neuronal interactions in promoting glioma progression. Mesenchymal transition was associated with the presence of a myeloid cell state defined by specific ligand-receptor interactions with neoplastic cells. Collectively, these recurrence-associated phenotypes represent potential targets to alter disease progression.",LOF
35649669,"We examined frequencies of radiation-induced chromosomal aberrations, using classical cytological methods, and DNA damage in interphase and metaphase cells, using a combination of FISH, CO-FISH, TIF (telomere dysfunction induced assay) and simultaneous detection of DNA damage and telomeric sequences in metaphase chromosomes, in Chinese hamster cells defective in BRCA2 and control cells. Given that the Chinese hamster genome contains large blocks of interstitial telomeric sites, our results allow us to examine the role of BRCA2 in the potential fragility of these sites, but also whether BRCA2 affects DNA repair within terminal telomeric sequences. BRCA2 defective cells exhibited greater frequencies of DNA damage within interstitial telomeric sites, as well as within terminal telomeric sites, relative to control cells. Therefore, BRCA2 deficiency contributes to the telomere dysfunction phenotype in Chinese hamster cells.",LOF
35649705,"Ellagic acid (EA) is a phenolic constituent in certain fruits and has largely been recognized for its role as an antioxidant compound.
To evaluate the effect of EA on beryllium sulphate-induced splenic toxicity in rats.
Male Sprague-Dawley rats were divided into four groups. The first group was used as control. Group 2 was exposed to BeSO
BeSO
Our results suggest EA treatment exerts a significant protective effect on BeSO",GOF
35649811,"Superconducting Radio Frequency (SRF) cavities used in particle accelerators are typically formed from or coated with superconducting materials. Currently, high purity niobium is the material of choice for SRF cavities that have been optimized to operate near their theoretical field limits. This brings about the need for significant R & D efforts to develop next generation superconducting materials that could outperform Nb and keep up with the demands of new accelerator facilities. To achieve high quality factors and accelerating gradients, the cavity material should be able to remain in the superconducting Meissner state under a high RF magnetic field without penetration of quantized magnetic vortices through the cavity wall. Therefore, the magnetic field at which vortices penetrate a superconductor is one of the key parameters of merit of SRF cavities. Techniques to measure the onset of magnetic field penetration on thin film samples need to be developed to mitigate the issues with the conventional magnetometry measurements that are strongly influenced by the film orientation and shape and edge effects. In this work, we report the development of an experimental setup to measure the field of full flux penetration through films and multi-layered superconductors. Our system combines a small superconducting solenoid that can generate a magnetic field of up to 500 mT at the sample surface and three Hall probes to detect the full flux penetration through the superconductor. This setup can be used to study alternative materials that could potentially outperform niobium, as well as superconductor-insulator-superconductor (SIS) multilayer coatings on niobium.",GOF
35649860,"The ab initio elongation (ELG) method based on a polymerization concept is a feasible way to perform linear-scaling electronic structure calculations for huge aperiodic molecules while maintaining computational accuracy. In the method, the electronic structures are sequentially elongated by repeating (1) the conversion of canonical molecular orbitals (CMOs) to region-localized MOs (RLMOs), that is, active RLMOs localized onto a region close to an attacking monomer or frozen RLMOs localized onto the remaining region, and the subsequent (2) partial self-consistent-field calculations for an interaction space composed of the active RLMOs and the attacking monomer. For each ELG process, one can obtain local CMOs for the interaction space and the corresponding local orbital energies. Local site information, such as the local highest-occupied/lowest-unoccupied MOs, can be acquired with linear-scaling efficiency by correctly including electronic effects from the frozen region. In this study, we performed a local electronic structure analysis using the ELG method for various DNA block polymers with different sequential patterns. This benchmark aimed to confirm the effectiveness of the method toward the efficient detection of a singular local electronic structure in unknown systems as a future practical application. We discussed the high-throughput efficiency of our method and proposed a strategy to detect singular electronic structures by combining with a machine learning technique.",GOF
35649995,"We study the dynamic control of birhythmicity under an impulsive feedback control scheme where the feedback is made ON for a certain rather small period of time and for the rest of the time, it is kept OFF. We show that, depending on the height and width of the feedback pulse, the system can be brought to any of the desired limit cycles of the original birhythmic oscillation. We derive a rigorous analytical condition of controlling birhythmicity using the harmonic decomposition and energy balance methods. The efficacy of the control scheme is investigated through numerical analysis in the parameter space. We demonstrate the robustness of the control scheme in a birhythmic electronic circuit where the presence of noise and parameter fluctuations are inevitable. Finally, we demonstrate the applicability of the control scheme in controlling birhythmicity in diverse engineering and biochemical systems and processes, such as an energy harvesting system, a glycolysis process, and a p53-mdm2 network.",GOF
35650195,"Desmoplastic small round cell tumor (DSRCT) is an aggressive, usually incurable sarcoma subtype that predominantly occurs in post-pubertal young males. Recent evidence suggests that the androgen receptor (AR) can promote tumor progression in DSRCTs. However, the mechanism of AR-induced oncogenic stimulation remains undetermined. Herein, we demonstrate that enzalutamide and AR-directed antisense oligonucleotides (AR-ASO) block 5α-dihydrotestosterone (DHT)-induced DSRCT cell proliferation and reduce xenograft tumor burden. Gene expression analysis and chromatin immunoprecipitation sequencing (ChIP-seq) were performed to elucidate how AR signaling regulates cellular epigenetic programs. Remarkably, ChIP-seq revealed novel DSRCT-specific AR DNA binding sites adjacent to key oncogenic regulators, including WT1 (the C-terminal partner of the pathognomonic fusion protein) and FOXF1. Additionally, AR occupied enhancer sites that regulate the Wnt pathway, neural differentiation, and embryonic organ development, implicating AR in dysfunctional cell lineage commitment. Our findings have direct clinical implications given the widespread availability of FDA-approved androgen-targeted agents used for prostate cancer.",LOF
35650206,"Acute B-cell lymphoblastic leukemia (B-ALL) results from oligo-clonal evolution of B-cell progenitors endowed with initiating and propagating leukemia properties. The activation of both the Rac guanine nucleotide exchange factor (Rac GEF) Vav3 and Rac GTPases is required for leukemogenesis mediated by the oncogenic fusion protein BCR-ABL. Vav3 expression becomes predominantly nuclear upon expression of BCR-ABL signature. In the nucleus, Vav3 interacts with BCR-ABL, Rac, and the polycomb repression complex (PRC) proteins Bmi1, Ring1b and Ezh2. The GEF activity of Vav3 is required for the proliferation, Bmi1-dependent B-cell progenitor self-renewal, nuclear Rac activation, protein interaction with Bmi1, mono-ubiquitination of H2A(K119) (H2AK119Ub) and repression of PRC-1 (PRC1) downstream target loci, of leukemic B-cell progenitors. Vav3 deficiency results in de-repression of negative regulators of cell proliferation and repression of oncogenic transcriptional factors. Mechanistically, we show that Vav3 prevents the Phlpp2-sensitive and Akt (S473)-dependent phosphorylation of Bmi1 on the regulatory residue S314 that, in turn, promotes the transcriptional factor reprogramming of leukemic B-cell progenitors. These results highlight the importance of non-canonical nuclear Rho GTPase signaling in leukemogenesis.",GOF
35650277,"ABL-class fusions including NUP214-ABL1 and EBF1-PDGFRB occur in high risk acute lymphoblastic leukaemia (ALL) with gene expression patterns similar to BCR-ABL-positive ALL. Our aim was to evaluate new DNA-based measurable residual disease (MRD) tests detecting these fusions and IKZF1-deletions in comparison with conventional immunoglobulin/T-cell receptor (Ig/TCR) markers.
Precise genomic breakpoints were defined from targeted or whole genome next generation sequencing for ABL-fusions and BCR-ABL1. Quantitative PCR assays were designed and used to re-measure MRD in remission bone marrow samples previously tested using Ig/TCR markers. All MRD testing complied with EuroMRD guidelines.
ABL-class patients had 46% 5year event-free survival and 79% 5year overall survival. All had sensitive fusion tests giving high concordance between Ig/TCR and ABL-class fusion results (21 patients, n = 257 samples, r2 = 0.9786, P < 0.0001) and Ig/TCR and IKZF1-deletion results (9 patients, n = 143 samples, r2 = 0.9661, P < 0.0001). In contrast, in BCR-ABL1 patients, Ig/TCR and BCR-ABL1 tests were discordant in 32% (40 patients, n = 346 samples, r2 = 0.4703, P < 0.0001) and IKZF1-deletion results were closer to Ig/TCR (25 patients, n = 176, r2 = 0.8631, P < 0.0001).
MRD monitoring based on patient-specific assays detecting gene fusions or recurrent assays for IKZF1-deletions is feasible and provides good alternatives to Ig/TCR tests to monitor MRD in ABL-class ALL.",GOF
35650343,"To explore the emission characteristics of vehicle's pollutants is of great significance to prevent and control the diffusion of pollutants. Limited by geographic location and economic condition, the model- and guideline-based studies on vehicle's emission factor have become more concerned measures than the actual measurement. By analyzing the actual operating conditions of motor vehicles, this study obtains the emission factors of typical pollutants from different motor vehicles by adopting international vehicle emission (IVE) model and guideline method, respectively. Furthermore, the resulting emission factors by the above methods were compared and analyzed with on-road method. The results show that: (1) the emission factors of vehicle pollutants change regularly with velocity, emission standard, and accumulated mileage. Taking CO as an example, its emission factor shows a downward trend with the increase of velocity and emission standard and an upward trend with the increase of accumulated mileage; (2) compared with the actual measurement, the vehicle emission factor obtained by the guideline method has a large error, while the IVE model is close to the actual.",GOF
35650435,"Disseminated cancer cells from primary tumours can seed in distal tissues, but may take several years to form overt metastases, a phenomenon that is termed tumour dormancy. Despite its importance in metastasis and residual disease, few studies have been able to successfully characterize dormancy within melanoma. Here we show that the aged lung microenvironment facilitates a permissive niche for efficient outgrowth of dormant disseminated cancer cells-in contrast to the aged skin, in which age-related changes suppress melanoma growth but drive dissemination. These microenvironmental complexities can be explained by the phenotype switching model, which argues that melanoma cells switch between a proliferative cell state and a slower-cycling, invasive state",GOF
35650536,"Phoebe bournei (P. bournei) is an important and endemic wood species in China. However, the plantation, nursing, and preservation of P. bournei are often affected by light. To investigate its physiological changes and molecular mechanism of low light tolerance, two-year-old P. bournei seedlings were subjected to different shading conditions. With the increase of light intensity in the shade, the leaf color of P. bournei seedlings became darkened, the aboveground/underground biomass significantly increased, the content of chlorophyll increased and the net photosynthetic rate significantly increased.
de novo transcriptome analysis showed that 724 and 3,248 genes were differentially expressed due to low light intensity at T1 (35% light exposure) and T2 (10% light exposure), respectively, when compared to the controls. Furthermore, the differentially expressed genes (DEGs) were implicated in photosynthesis, nitrogen metabolism, plant hormone signal transduction, biosynthesis of secondary metabolites, and protein processing in the endoplasmic reticulum by functional enrichment analysis. Moreover, the expression of HSP, CAB, HEMA1, GSA, DVR, MYB, bHLH, PORA, CAO, GLK, and photosystem I and II complex-related genes significantly increased after low light exposure at T2 and T1.
The present study suggests that the rapid growth of P. bournei seedlings under shading conditions may be the result of the accelerated expression of genes related to photosynthesis and chlorophyll biosynthesis, which enable plants to maintain a high photosynthesis rate even under low light conditions.",GOF
35650543,"Global and country specific recommendations on Delayed umbilical cord clamping (DCC) are available, though guidance on their implementation in program settings is lacking. In India, DCC (clamping not earlier than 1 min after birth) is a component in the package of services delivered as part of the India Newborn Action Plan (INAP) supported by Nutrition International (NI) in two states. The objective of this case study was to document the learnings from implementation of DCC in these two states and to understand the health system factors that affected its operationalization.
Mixed methods were followed. Using the World Health Organization (WHO) Health Systems building blocks as a framework, 20 Key-Informant Interviews were conducted to explore facilitators and barriers to routine implementation of DCC in public health settings. Existing quantitative program data and secondary data from labour-room registers from eight NI- supported districts were analysed to assess the prevalence of DCC implementation in public health systems settings.
A demonstrated commitment from the government to implement DCC at all delivery points in NI supported districts was observed. Funds were sufficient, trainings were optimal, knowledge of the health workforce was adequate and a recording mechanism was in place. According to record reviews, DCC was more likely to happen in facilities that provide Basic Emergency Obstetric services and among normal deliveries. It was less likely to be followed in babies delivered by Caesarean section (OR 0.03; 95%CI 0.02,0.05), birthweight < 2000 g (OR 0.22; 95%CI 0.12,0.47), multiple pregnancies (OR 0.17, 95%CI 0.05,0.63), birth asphyxia requiring resuscitation (0.37; 95%CI 0.26,0.52), and those delivered during day shift (OR 0.59, 95%CI 0.40, 0.83).
Wide coverage of DCC in public health settings in the two states was observed. Good governance, adequate funding, commitment of health workforce has likely contributed to its success in these contexts. These are critical elements to guide DCC implementation in India and for consideration in other settings.",LOF
35650563,"Tumor heterogeneity has frequently been observed in gastric cancer (GC), but the correlation between patients' clinico-pathologic features and the tumoral heterogeneity of GC-associated molecules is unclear. We investigated the correlation between lymph node metastasis and the intra-tumoral heterogeneity of driver molecules in GC.
We retrospectively analyzed the cases of 504 patients who underwent a gastrectomy at the Department of Gastroenterological Surgery, Osaka Metropolitan University and 389 cases drawn from The Cancer Genome Atlas (TCGA) data. We performed a clustering analysis based on eight cancer-associated molecules including HER2, c-Met, and p-Smad2 using the protein expression revealed by our immunohistochemical study of the patients' and TCGA cases. We determined the correlations between HER2 expression and the other molecules based on the degree of lymph node metastasis.
Immunohistochemical staining data showed that a 43 of the 504 patients with GC (8.5%) were HER2-positive. In the HER2-positive cases, the expressions of c-Met and p-Smad2 were increased in accord with the lymph-node metastatic level. The overall survival of the HER2-positive GC patients with both p-Smad2 and c-Met expression was significantly (p = 0.030) poorer than that of the patients with p-Smad2-negative and/or c-Met-negative expression. The results of the TCGA data analysis revealed that 58 of the 389 GC cases (14.9%) were ERBB2-positive. MET expression was more frequent in the N1 metastasis group than the N0 group. In the high lymph-node metastasis (N2 and N3) group, SMAD2 expression was more frequent, as was ERBB2 and MET expression.
p-Smad2 and c-Met signaling might play important roles in lymph node metastasis in HER2-positive GC.",GOF
35650591,"The full-length BRCA1-associated RING domain 1 (BARD1) gene encodes a 777-aa protein. BARD1 displays a dual role in cancer development and progression as it acts as a tumor suppressor and an oncogene. Structurally, BARD1 has homologous domains to BRCA1 that aid their heterodimer interaction to inhibit the progression of different cancers such as breast and ovarian cancers following the BRCA1-dependant pathway. In addition, BARD1 was shown to be involved in other pathways that are involved in tumor suppression (BRCA1-independent pathway) such as the TP53-dependent apoptotic signaling pathway. However, there are abundant BARD1 isoforms exist that are different from the full-length BARD1 due to nonsense and frameshift mutations, or deletions were found to be associated with susceptibility to various cancers including neuroblastoma, lung, breast, and cervical cancers. This article reviews the spectrum of BARD1 full-length genes and its different isoforms and their anticipated associated risk. Additionally, the study also highlights the role of BARD1 as an oncogene in breast cancer patients and its potential uses as a prognostic/diagnostic biomarker and as a therapeutic target for cancer susceptibility testing and treatment.",LOF
35650607,"Epidermal growth factor receptor (EGFR) inhibitors, including cetuximab and panitumumab, are valuable therapeutics for colorectal cancer (CRC), but resistance to these inhibitors is common. The reason for such resistance is not well understood, which hampers development of better therapeutic strategies. Although activating mutations in KRAS, BRAF and PIK3CA are considered major drivers of CRC resistance to EGFR inhibitors, therapeutic targeting of these drug resistance drivers has not produced substantial clinical benefit.
We exploited cell lines and mouse tumor models (cell line xenografts and patient derived xenografts) for experiments of genetic and pharmacologic depletion of EGFR and/or its family member HER2, including EGFR mutants, inhibition of EGFR ligand shedding, and biochemical analysis of signaling proteins, to delineate the mechanism of CRC resistance to EGFR inhibitors and to assess the therapeutic activity of PEPD
The sensitivity of CRC cells to cetuximab and panitumumab correlates with the ability of these drugs to induce EGFR downregulation. PEPD
Our study shows that CRC resistance to EGFR inhibitors results primarily from the inability of the inhibitors to downregulate their target and that a PEPD",GOF
