pubmed_id,abstract,gene_type
35639629,"Peptide-drug conjugates that self-assemble into supramolecular nanomaterials have promise for uses in drug delivery. These discrete molecular species offer high and precise drug loading, affording efficient carriers for various therapeutic agents. Their peptide modules, meanwhile, enable biological targeting and stimuli-responsive function while also ordering the assembled nanostructure. The often hydrophobic drug payload likewise acts as a directive for self-assembly in aqueous media. Though accessible synthetic methods have allowed for extensive exploration of the peptide design space, the specific contributions of the drug molecule and its linker to the resulting assembly have been less explored. Hydrophobic drugs frequently have planar domains, conjugated π-systems, and isolated polar groups, which in turn can lead to specific and directional self-interactions. These energies of interaction affect the free energy landscape of self-assembly and may impact the form and assembly process of the desired nanomaterial. Here, two model supramolecular peptide-drug conjugates (sPDCs) are explored, composed of the corticosteroid dexamethasone conjugated to a conserved peptide sequence via two different linker chemistries. The choice of linker, which alters the orientation, rotational freedom, and number of stereoisomers of the prodrug in the final sPDC, impacts the mechanism and energetic barrier of assembly as well as the nano/macroscale properties of the resultant supramolecular materials. Accordingly, this work demonstrates the nonzero energetic contributions of the drug and its linker to sPDC self-assembly, provides a quantitative exploration of the sPDC free energy landscape, and suggests design principles for the enhanced control of sPDC nanomaterials to inform future applications as therapeutic drug carriers.",GOF
35639772,"In the presence of physiological monovalent cations, thousands of RNA G-rich sequences can form parallel G-quadruplexes (G4s) unless RNA-binding proteins inhibit, destabilize, or resolve the formation of such secondary RNA structures. Here, we have used a disease-relevant model system to investigate the biophysical properties of the RNA-binding protein HNRNPH1's interaction with G-rich sequences. We demonstrate the importance of two EWSR1-exon 8 G-rich regions in mediating the exclusion of this exon from the oncogenic EWS-FLI1 transcripts expressed in a subset of Ewing sarcomas, using complementary analysis of tumor data, long-read sequencing, and minigene studies. We determined that HNRNPH1 binds the EWSR1-exon 8 G-rich sequences with low nM affinities irrespective of whether in a non-G4 or G4 state but exhibits different kinetics depending on RNA structure. Specifically, HNRNPH1 associates and dissociates from G4-folded RNA faster than the identical sequences in a non-G4 state. Importantly, we demonstrate using gel shift and spectroscopic assays that HNRNPH1, particularly the qRRM1-qRRM2 domains, destabilizes the G4s formed by the EWSR1-exon 8 G-rich sequences in a non-catalytic fashion. Our results indicate that HNRNPH1's binding of G-rich sequences favors the accumulation of RNA in a non-G4 state and that this contributes to its regulation of RNA processing.",GOF
35639830,"The diagnosis of acute promyelocytic leukemia (APL) relies on the identification of PML::RARA fusion. While the majority of APL cases harbor a typical t(15;17)(q24;q21), atypical genetic mechanisms leading to the oncogenic PML::RARA fusion have been reported yet their frequency and scope remain poorly characterized. We assessed the genetic findings of 831 cases with APL investigated with concurrent chromosome banding analysis and dual-color dual-fusion fluorescence in situ hybridization (D-FISH) analysis at our institution over an 18.5-year timeframe. Seven-hundred twenty-three (87%) cases had a typical balanced t(15;17) with both testing modalities. Atypical karyotypic results including complex translocations, unbalanced rearrangements and insertional events occurred in 50 (6%) cases, while 6 (0.7%) cases were cryptic by conventional chromosome studies despite PML::RARA fusion by D-FISH evaluation. Atypical FISH patterns were observed in 48 (6%) cases despite apparently balanced t(15;17) on chromosome banding analysis. Two-hundred fifty (30%) cases displayed additional chromosome abnormalities of which trisomy/tetrasomy 8 (37%), del(7q)/add(7q) (12%) and del(9q) (7%) were most frequent. Complex and very complex karyotypes were observed in 81 (10%) and 34 (4%) cases, respectively. In addition, 4 (0.5%) cases presented as an apparently doubled, near-tetraploid stemline clone. This report provides the largest appraisal of cytogenetic findings in APL with conventional chromosome and PML::RARA D-FISH analysis. By characterizing the frequency and breadth of typical and atypical results through the lens of these cytogenetic testing modalities, this study serves as a pragmatic source of information for those involved in the investigation of APL in both the clinical and research laboratory settings.",GOF
35639925,"Synechococcus elongatus, formerly known as Anacystis nidulans, is a representative species of cyanobacteria. It is also a model organism for the study of photoreactivation, which can be fully photoreactivated even after receiving high UV doses. However, for a long time, only one photolyase was found in S. elongatus that is only able to photorepair UV induced cyclobutane pyrimidine dimers (CPDs) in DNA. Here, we characterize another photolyase in S. elongatus, which belongs to iron-sulfur bacterial cryptochromes and photolyases (FeS-BCP), a subtype of prokaryotic 6-4 photolyases. This photolyase was named SePhrB that could efficiently photorepair 6-4 photoproducts in DNA. Chemical analyses revealed that SePhrB contains a catalytic FAD cofactor and an iron-sulfur cluster. All of previously reported FeS-BCPs contain 6,7-dimethyl-8-ribityllumazine (DMRL) as their antenna chromophores. Here, we first demonstrated that SePhrB possesses 7,8-didemethyl-8-hydroxy-5-deazariboflavin (8-HDF) as an antenna chromophore. Nevertheless, SePhrB could be photoreduced without external electron donors. After being photoreduced, the reduced FAD cofactor in SePhrB was extremely stable against air oxidation. These results suggest that FeS-BCPs are more diverse than expected which deserve further investigation.",GOF
35640016,"Briceño-Torres, JM, Carpio-Rivera, E, Solera-Herrera, A, Forsse, J, Grandjean, PW, and Moncada-Jiménez, J. Low-intensity resistance training improves flow-mediated dilation in young hispanic adults. J Strength Cond Res XX(X): 000-000, 2022-The purpose of this study was to compare the effects of 2 resistance exercise training (RET) intensities on brachial artery flow-mediated dilatation (FMD) in sedentary males. Thirty-four men (age = 20.6 ± 1.8 years, height = 171.3 ± 5.2 cm, body mass = 65.2 ± 10.6 kg, and DXA fat mass = 22.3 ± 7.4%) were randomly assigned to a control group (no exercise CTRL, n = 12), RET at 50% of 1 repetition maximum (1RM) (RET50%, n = 12), and RET at 80% 1RM (RET80%, n = 10). The RET program was performed twice per week for 8 weeks; subjects performed the same RET exercises at similar total workloads (1920 arbitrary units [AUs] for the RET80% and 1950 AUs for the RET50%). The FMD% was measured before and after 8 weeks by ultrasound. Mixed factorial analysis of variance (3 groups × 2 measurements), effect size (ES), and 95% confidence intervals (95% CIs) were computed for FMD%. The level of significance was set at p ≤ 0.05. A significant increase (p = 0.001) was found on post-test FMD% in RET50% (mean = 9.9 ± 3.7%, ES = 1.9, and 95% CIs = 2.8-0.9) compared with CTRL (mean = 5.7 ± 1.7%, ES = 0.2, and 95% CIs = -0.4 to 0.8), and there were no significant differences found between RET50% and RET80% and between RET80% and CTRL. Results support the concept of training specificity and provide preliminary evidence that lower resistance and higher repetition RET elicit greater short-term reduced endothelium dysfunction than higher intensity RET at similar training volume.",GOF
35640153,"The shoot apical meristem (SAM), which is formed during embryogenesis, generates leaves, stems, and floral organs during the plant life cycle. SAM development is controlled by SHOOT MERISTEMLESS (STM), a conserved Class I KNOX transcription factor that interacts with another subclass homeodomain protein, BELL, to form a heterodimer, which regulates gene expression at the transcriptional level in Arabidopsis (Arabidopsis thaliana). Meanwhile, SKI-INTERACTING PROTEIN (SKIP), a conserved protein in eukaryotes, works as both a splicing factor and as a transcriptional regulator in plants to control gene expression at the transcriptional and post-transcriptional levels by interacting with distinct partners. Here, we show that, similar to plants with a loss of function of STM, a loss of function of SKIP or the specific knockout of SKIP in the SAM region resulted in failed SAM development and the inability of the mutants to complete their life cycle. In comparison, Arabidopsis mutants that expressed SKIP specifically in the SAM region formed a normal SAM and were able to generate a shoot system, including leaves and floral organs. Further analysis confirmed that SKIP interacts with STM in planta and that SKIP and STM regulate the expression of a similar set of genes by binding to their promoters. In addition, STM also interacts with EARLY FLOWERING 7 (ELF7), a component of Polymerase-Associated Factor 1 complex (Paf1c), and mutation in ELF7 exhibits similar SAM defects to that of STM and SKIP. This work identifies a component of the STM transcriptional complex and reveals the mechanism underlying SKIP-mediated SAM formation in Arabidopsis.",GOF
35640446,"European health reforms during the last decades have strengthened patient rights and introduced choice, competition and financial incentives in a sector that has typically been state-directed and centrally controlled. The marketisation of health care has also drawn out profit and introduced private provision. The main argument behind this trend is that market competition will improve service quality and deliver health services more efficiently. Such reforms often fall under the umbrella of New Public Management (NPM), and there is a lack of empirical research on their effects. The purpose of this paper is to investigate the association between healthcare marketisation and health system outcomes across European nations. In order to measure a country's degree of healthcare marketisation we employed indicators of healthcare decommodification. The concept refers to the extent to which an individual's access to healthcare is dependent upon their market position and the extent to which a country's provision of health is independent from the market. These indicators are three measures that assess the financing, provision and coverage of the private sector, and thus reflects the varied role of the market in a health care system: private health care expenditure as amount of GDP, private hospital beds as amount of total hospital bed stock, and public healthcare coverage. As indicator of health system outcome, we employed a measure that has not previously been investigated in the context of healthcare marketisation: satisfaction with health care system. We used multilevel analyses on five waves (2009-2017) of the biannual European Social Survey (ESS), with our final models including more than 120,000 individuals from 21 countries. Our methodological approach allowed us to study both cross-sectional and longitudinal relationships. The strongest substantial associations were between coverage and satisfaction, with high public healthcare coverage being associated with higher satisfaction.",GOF
35640677,"Here we report that HES1, known to repress gene transcription in progenitor cells of several cell lineages, is strongly expressed in cells and tissues of T-cell lymphoma expressing the oncogenic chimeric tyrosine kinase NPM-ALK (ALK+TCL). The structure analysis of the orange domain of HES1 indicates that HES1 forms a highly stable homodimer. Of note, repression of HES1 expression leads to inhibition of ALK+TCL cell growth in vivo. The expression of the HES1 gene is induced by NPM-ALK through activation of STAT3 which binds to the gene's promoter and induces the gene's transcription. NPM-ALK also directly phosphorylates HES1 protein. In turn, HES1 up- and down-regulates in ALK+TCL cells expression of numerous genes, protein products of which are involved in key cell functions such as cell proliferation and viability. Among the genes inhibited by HES1 is TXNIP, encoding a protein implicated in promotion of cell death in various types of cells. Accordingly, ALK+TCL cells and tissues lack expression of TXNIP and its transcription is co-inhibited by HES1 and STAT3 in an NPM-ALK-dependent manner. Finally, the induced expression of TXNIP induces massive apoptotic cell death of ALK+TCL cells. The results revealed a novel, the NPM-ALK-controlled pro-oncogenic regulatory network and document an important role of HES and TXNIP in the NPM-ALK-driven oncogenesis, with the former protein displaying oncogenic and the latter tumor suppressor properties.",GOF
35641028,"Although the use of BCR-ABL1 tyrosine kinase inhibitors (TKIs) for chronic myeloid leukemia is known to cause vascular adverse events (VAEs), the frequency of VAEs during dasatinib administration is not high, and the same holds for atherosclerosis-related VAEs. However, its effect on atherosclerosis remains controversial. In this study, our primary objective was to investigate how dasatinib affects atherosclerosis. Ldlr",GOF
35641029,"Microglia have diverse physiological and pathological functions. However, the transcriptional mechanisms remain elusive. Here we sought new transcription factors relevant to microglial functions from the microglial transcriptome of stressed mice and evaluated their roles in primary microglia. TLR2 and TLR4 agonists increased Rel, Atf3, and Cebpb and decreased Hhex in primary microglia as repeated social defeat stress. Although Hhex was not studied in microglia, TLR2 and TLR4 agonists decreased Hhex, and Hhex overexpression attenuated TLR4-increased expression of inflammation-related genes. These findings suggest that Hhex negatively regulates inflammation-related genes in microglia and that TLR2/4 activation reduces Hhex, facilitating TLR4-mediated neuroinflammation.",GOF
35641204,"Limited studies have suggested that mucinous histology is associated an attenuated response to anti-epidermal growth factor receptor (EGFR) therapy.
We conducted a single-institution, retrospective study to review the anti-EGFR response and the molecular profile of patients with left-sided microsatellite stable RAS/BRAF wild-type mucinous metastatic colorectal cancer.
In comparison to nonmucinous population (n = 98), mucinous histology (n = 20) was associated with a younger age (48 vs 54, P = .02), wild-type APC (80% vs 15.3%, P < .0001), and wild-type TP53 (40% vs 8.2%, P = .001). Guanine nucleotide binding protein, alpha stimulating (GNAS) mutations were exclusively found in mucinous tumors (20% vs 0, P < .0001). Genomic alterations associated with resistance to anti-EGFR therapy, such as ERBB2 amplification, PIK3CA mutation, MAP2K1 mutation, and KRAS amplification, were identified in patients with left-sided RAS/BRAF wild-type mucinous metastatic colorectal cancer. Mucinous histology was not associated with a worse outcome than non-mucinous histology (34.3 vs 42.2 months, P = .85). However, patients with left-sided RAS/BARF wild-type mucinous colorectal cancer treated with first-line anti-EGFR therapy had significantly worse progression-free survival (4 vs 6.5 months, hazard ratio [HR] = 5.3, 95% confidence interval [CI] 1.3-21.7, P = .01) than patients treated with the first-line vascular endothelial growth factor A antibody, bevacizumab. Anti-EGFR therapy was associated with limited responses and a short PFS across all lines of therapy in 12 patients with left-sided RAS/BRAF wild-type mucinous colorectal cancer.
Mucinous histology is associated with diminished benefits from anti-EGFR therapy in patients with left-sided RAS/BRAF wild-type colorectal cancer. These patients should be considered for bevacizumab-based therapy in the first- and second-line settings.",GOF
35641210,"BCR-ABL1 kinase inhibitors have improved the prognosis of Philadelphia-chromosome-positive (Ph+)-acute lymphoblastic leukemia (ALL). Ph-like (or BCR-ABL1-like) ALL does not express BCR-ABL1 but commonly harbors other genomic alterations of signaling molecules that may be amenable to therapy. Here, we report a case with a NUP214-ABL1 fusion detected at relapse by multiplexed, targeted RNA sequencing. It had escaped conventional molecular work-up at diagnosis, including cytogenetic analysis and fluorescence in situ hybridization for ABL1 rearrangements. The patient had responded poorly to initial multi-agent chemotherapy and inotuzumab immunotherapy at relapse before the fusion was revealed. The addition of dasatinib targeting NUP214-ABL1 to inotuzumab resulted in complete molecular remission, but recurrence occurred rapidly with dasatinib alone. However, deep molecular remission was recaptured with a combination of blinatumomab and ponatinib, so he could proceed to allotransplantation. This case illustrates that next-generation sequencing approaches designed to discover cryptic gene fusions can benefit patients with Ph-like ALL.",GOF
35641213,"About 10% of breast cancer (BC) is diagnosed in stage IV. This study sought to identify factors associated with time to progression (TTP) and overall survival (OS) in a cohort of patients diagnosed with de novo metastatic breast cancer (MBC), from a single cancer center in Colombia, given that information on this aspect is limited.
An observational, analytical, and retrospective cohort study was carried out. Time to progression and OS rates were estimated using the Kaplan-Meier survival functions. Cox models were developed to assess association between time to progression and time to death, using a group of fixed variables.
Overall, 175 patients were included in the study; 33.7% of patients had luminal B HER2-negative tumors, 49.7% had bone involvement, and 83.4% had multiple metastatic sites. Tumor biology and primary tumor surgery were the variables associated with TTP and OS. Patients with luminal A tumors had the lowest progression and mortality rates (10 per 100 patients/year (95% CI: 5.0-20.0) and 12.6 per 100 patients/year (95% CI: 6.9-22.7), respectively), and patients with triple-negative tumors had the highest progression and mortality rates (40 per 100 patients/year (95% CI: 23.2-68.8) and 44.1 per 100 patients/year (95% CI: 28.1-69.1), respectively). Across the cohort, the median TTP was 2.1 years (95% CI: 1.6; the upper limit cannot be reached) and the median OS was 2.4 years (95% CI: 2-4.3).
In this cohort, patients with luminal A tumors and those who underwent tumor surgery given that they presented clinical benefit (CB) after initial systemic treatment, had the lowest progression and mortality rates. Overall, OS was inferior to other series due to high tumor burden and difficulties in accessing and continuing oncological treatments.",GOF
35641267,"In the autosomal dominant hereditary disease neurofibromatosis type 1 (NF1), lesions of the jaw develop in isolated cases, which are diagnosed as central giant cell granuloma (CGCG). This study aimed to clarify the genetic basis of a bone lesion in a syndromic patient.
The NF1 patient had developed a CGCG that recurred after local excision. Blood and tumor tissue were studied for NF1 mutations using advanced molecular genetic methods. Examinations of blood and tumor tissue provided evidence of the constitutive mutation in both samples. A further mutation was detected in the tumor, which was interpreted as a somatic mutation. The detection of somatic mutation in the tissue was successful both on native and routinely fixed material.
The study supports current assessments of CGCG as a benign neoplasm. In NF1 patients, the phenotype seems to imply bi-allelic loss of the NF1 gene. The detection of both mutations in routinely fixed tissue allows studies of archived tissue samples with this diagnosis.",LOF
35641481,"In the later-line setting or for patients with PD-L1-negative tumors, immunotherapy-based regimens remain ineffective against advanced triple-negative breast cancer (TNBC). In this multicentered phase II trial (NCT04303741), 46 patients with pretreated advanced TNBC were enrolled to receive camrelizumab 200 mg (day 1), and apatinib 250 mg daily, plus eribulin 1.4 mg/m",GOF
35641486,"Acute liver failure (ALF) is a rare entity but exhibits a high mortality. The mechanisms underlying ALF are not completely understood. The present study explored the role of the hepatic B cell leukemia-3 (Bcl-3), a transcriptional regulator of nuclear factor-kappa B (NF-κB), in two independent models of ALF. We employed a recently developed transgenic mouse model in a C57BL6/J background comparing wild-type (WT) and transgenic littermates with hepatocyte-specific overexpression of Bcl-3 (Bcl-3",GOF
35641565,"Electroretinography (ERG) is used to evaluate the physiological status of the retina and optic nerve. The purpose of this study was to determine the usefulness of ERGs recorded with the RETeval system in diagnosing optic nerve diseases. Forty-eight patients with optic nerve disorders, including optic neuritis, ischemic optic neuropathy, traumatic optic neuropathy, and dominant optic atrophy, and 36 normal control subjects were studied. The amplitudes of the photopic negative response (PhNR) were recorded with the RETeval system without mydriasis. The circumpapillary retinal nerve fiber layer thickness (cpRNFLT) was determined by optical coherence tomography (OCT). The significance of the correlations between the PhNR and cpRNFLT parameters were determined, and the receiver operating curve (ROC) analyses were performed for the PhNR and cpRNFLT. Patients with optic nerve disorders had significantly smaller PhNRs compared to the control subjects (P = 0.001). The ROC analyses indicated that both PhNR and cpRNFLT had comparable diagnostic abilities of detecting optic nerve disorders with PhNR at 0.857 and cpRNFLT at 0.764. The PhNR components recorded with the RETeval system have comparable diagnostic abilities as the cpRNFLT in diagnosing optic nerve disorders.",GOF
35641658,"Lung adenocarcinoma (LUAD) is a heterogeneous disease. Our study aimed to understand the unique molecular features of preinvasive to invasive LUAD subtypes. We retrospectively analyzed the clinical, histopathological, and molecular data of 3,254 Chinese patients with preinvasive lesions (n = 252), minimally invasive adenocarcinomas (n = 479), and invasive LUAD (n = 2,523). Molecular data were elucidated using a targeted 68-gene next-generation sequencing panel. Our findings revealed four preinvasive lesion-predominant gene mutations, including MAP2K1 insertion-deletions (indels), BRAF non-V600E kinase mutations, and exon 20 insertions (20ins) in both EGFR and ERBB2, which we referred to as mutations enriched in AIS (MEA). The detection rate of MEA in invasive tumors was relatively lower. MAP2K1 missense mutations, which were likely passenger mutations, co-occurred with oncogenic driver mutations, while small indels were mutually exclusive from other genes regardless of the invasion level. BRAF non-V600E kinase-mutant invasive adenocarcinomas (IAC) had significantly higher mutation rates in tumor suppressor genes but lower frequency of co-occurring oncogenic driver mutations than non-kinase-mutant IAC, suggesting the potential oncogenic activity of BRAF non-V600E kinase mutations albeit weaker than BRAF V600E. Moreover, similar to the extremely low frequency of MAP2K1 indels in IAC, BRAF non-V600E kinase domain mutations co-occurring with TSC1 mutations were exclusively found in preinvasive lesions. Compared with EGFR L858R and exon 19 deletion, patients with preinvasive lesions harboring 20ins in either EGFR or ERBB2 were significantly younger, while those with IAC had similar age. Furthermore, our study demonstrated distinct mutational features for subtypes of oncogene mutations favored by different invasion patterns in adenocarcinomas. In conclusion, our data demonstrate distinct mutational features between preinvasive lesions and invasive tumors with MEA, suggesting the involvement of MEA in the early stages of tumorigenesis. Further pre-clinical studies are required to establish the role of these genes in the malignant transformation of LUAD.",GOF
