pubmed_id,abstract,gene_type
10420150,"Loss of heterozygosity (LOH) on chromosome arm 18q is common in sporadic prostate cancer and may be involved in cancer development through inactivation of tumor-suppressor genes (TSG). Recent identification, at 18q21.1, of MADR2/Smad2, a key component in transforming growth factor beta (TGFbeta)-family signaling pathways, led us to investigate the role of this gene in prostate tumorigenesis.
Sporadic primary prostate tumors from 25 patients with clinically localized tumors and 7 with metastatic forms were examined for MADR2/Smad2 mutations by using polymerase chain reaction-single-strand conformational polymorphism (PCR-SSCP) analysis of cDNA, and for gene expression by quantitative reverse transcription-polymerase chain reaction (RT-PCR).
We detected no mutation in MADR2/Smad2 and no abnormal mRNA expression.
Despite recent evidence indicating that MADR2/Smad2 acts as a tumor-suppressor gene, our findings suggest a limited role of this gene in prostate tumorigenesis, at least in the early stages. Another key tumor-suppressor gene may therefore be the main target of the observed LOH at 18q21.1.",LOF
10451707,"Recently, three candidate tumor suppressor genes, SMAD2 (MADR2/JV18-1), SMAD4 (DPC4), and DCC, were identified in chromosome band 18q21. We examined allelic imbalance (AI) in 18q21 using six polymorphic microsatellite markers in 38 primary ovarian cancers and four ovarian borderline tumors. AI at one or more loci was detected in 15 of 37 (41%) informative ovarian cancers and in none of the four borderline tumors. Frequent AI was detected at the D18S46 (31%) and D18S474 (36%) loci, which were adjacent to the SMAD4 gene, and at the D18S69 (33%) locus, which was telomeric to the DCC gene. Therefore, we searched for mutations of the SMAD4 gene in 42 primary tumors and eight cell lines by PCR-SSCP and sequencing analyses. Missense mutations were detected in two ovarian tumors and three ovarian cancer cell lines, whereas silent mutation was detected in a primary ovarian cancer. These results suggest that there are at least two tumor suppressor genes on chromosome arm 18q and that SMAD4 is of importance in ovarian tumorigenesis.",LOF
10910046,"Loss of heterozygosity (LOH) on 18q predicts poor survival in head and neck squamous cell carcinomas (HNSCCs). Several putative tumor suppressor genes, such as DCC, DPC4/Smad4, and MADR2/Smad2, are mapped to 18q, but thus far, the important gene locus in HNSCC is not known. To identify possible gene loci on 18q, we performed LOH studies using tumor DNA from 57 HNSCC primary tumor cell lines and DNA isolated from fibroblasts or lymphoblastoid cells from the same patients. Forty-two highly polymorphic microsatellite markers spaced not more than 5 cM apart (mean distance, 1.82 cM) spanning the region from D18S44 in 18q11.1 to D18S1141 in 18q23 were used. D18S71 in 18p11.21 on 18p was also used to determine whether the short arm was retained. Forty-three of 57 (75%) HNSCC lines showed LOH or isolated allelic imbalance (AI) for at least one locus on 18q. Although many of the cell lines had large distal 18q deletions with a breakpoint between 18q11.1 and 18q12.2 to qter, three loci were identified that were lost in 70% or more of the cases. The minimally lost regions (MLRs) range in size from 1.5-15.79 cM. The most proximal is centered on D18S39 (1.56 cM) in band 18q21.1, with LOH or isolated AI in 28 of 38 (74%) of informative cases. The largest (15.8 cM) begins at D18S61 (28 of 40; 70%) in band 18q22.2 and extends through D18S50 in 18q23. The third is centered on D18S70 (30 of 40; 75%) in band 18q23 (3.67 cM). Of these MLRs, only the one centered on D18S39 has been implicated previously in HNSCC. D18S70, the most frequently lost marker, was the only marker consistently lost in three tumor cell lines with very minimal losses, UM-SCC-19, UM-SCC-67, and UM-SCC-73A. In addition, UM-SCC-91 exhibited AI only at this locus, and UT-SCC-4 had AI at D18S70 and D18S39 only. Close physical mapping of these three regions may pinpoint one or more previously unidentified tumor suppressor genes.",LOF
11172591,"The DPC4 and Madr2 genes are located at 18q21, and the LOH on chromosome 18q21 has been shown to occur frequently in colorectal cancers. To investigate the role of these genes in advanced colorectal cancers, we analyzed 29 colorectal specimens for alterations in the DPC4 and Madr2 genes. Twelve (63.2%) of 19 informative primary colorectal cancers showed allelic loss of chromosome 18q21.3 marker. An alteration of the DPC4 gene sequence was identified in 6 (20.7%) of 29 colorectal carcinomas, and the distinct Madr2 gene mobility shifts were present in 3 (10.3%) cancers. Somatic mutations were identified in these tumors by sequencing analysis. DPC4 gene alterations of 4 cases were detected in Mad homology 2 domains. There was no significant correlation between the somatic alteration of Madr2 and clinicopathological findings. However, the frequency of DPC4 mutation was significantly higher in tumors associated with liver metastasis than in those without such metastasis. Our findings suggest that somatic alteration of the DPC4 gene may play a role in tumorigenesis and liver metastasis of human colorectal cancers.",LOF
11410498,"Transforming growth factor beta (TGF-beta) regulates cell growth and differentiation, in normal squamous epithelium, via specific TGF-beta receptors and intracellular signaling molecules (Smads). We have previously observed that TGF-beta type II receptor (TbetaR-II) expression decreases in squamous cell carcinomas as tumors become less differentiated and more biologically aggressive. However, a small fraction of tumors remain TbetaR-II positive. In this article, we examine the integrity of the other members of the TGF-beta-signaling machinery, the Smad proteins.
Thirteen archived head and neck squamous cell carcinomas were selected from the files of the Pathology Department of the H. Lee Moffitt Cancer Center. Protein immunoexpression was quantitated by image analysis in the context of histopathological parameters. Mutation analysis of the MADR2/Smad2 gene was also performed.
In both TbetaR-II-positive and TbetaR-II-negative tumors, expression of the non-TGF-beta-specific Smads (4, 6, and 7) was variable, whereas expression of the pathway-specific Smad2 was lost in 38% of the tumors. Expression of the activated, phosphorylated form of this molecule, Smad2-P, was lost in approximately 70% of the tumors. No abnormal mRNA expression and no mutations in the MADR2/Smad2 gene were observed.
These results suggest that multiple defects in TGF-beta signaling, both at the receptor and postreceptor level, may play a role in the oncogenesis of head and neck squamous cell carcinoma.",LOF
20699271,"T-cell intracellular antigen (TIA)-proteins are known regulators of alternative pre-mRNA splicing. In this study, pull-down experiments and mass spectrometry indicate that TIAR/TIAL1 and hnRNP C1/C2 are associated in HeLa nuclear extracts. Co-immunoprecipitation and GST-pull-down assays confirmed this interaction. Interestingly, binding requires the glutamine-rich (Q-rich) C-terminal domain of TIAR and the leucine-rich plus acidic residues-rich C-terminal domains of hnRNP C1/C2. This interaction also occurs in an RNA-dependent manner. Recombinant GFP-TIAR and RFP-hnRNP C1 proteins display partial nuclear co-localization when overexpressed in HeLa cells, and this requires the Q-rich domain of TIAR. hnRNP C1 overexpression in the presence of rate-limiting amounts of TIAR in HeLa and HEK293 cells affects alternative splicing of Fas and FGFR2 minigenes, promoting Fas exon 6 and FGFR2 exon K-SAM skipping, respectively. The repressor activity of hnRNP C1 on Fas exon 6 splicing is mediated by Hu antigen R (HuR). Experiments involving tethering approaches showed that the repressor capacity of hnRNP C1 is associated with an exonic splicing silencer in Fas exon 6. This effect was reversed by splice-site strengthening and is linked to its basic leucine zipper-like motif. These results suggest that hnRNP C1/C2 acts as a bridge between HuR and TIAR to modulate alternative Fas splicing.",GOF
23545898,"Although gastric cancer is increasingly being detected at an early stage of development, diffuse growth‑type malignant tumors, such as scirrhous gastric cancer, are usually at an advanced stage at the time of diagnosis, resulting in poor treatment outcomes. The aim of this study was to determine whether the K-sam gene and keratinocyte growth factor (KGF) expression may be used to identify malignant tumors with a poor prognosis. K-sam and KGF expression was retrospectively evaluated in samples from 86 patients with early and advanced gastric cancer according to type, by examining serum levels and using immunohistochemical staining. The associations with clinicopathological characteristics and survival were also examined. The mean serum KGF levels were 11.191±3.808 pg/ml in early stage and 10.715±3.4991 pg/ml in advanced gastric cancer patients. KGF levels were significantly higher in types 4 and 5 (14.498±3.812 pg/ml, n=6) compared with types 1, 2 and 3 (10.747±3.571 pg/ml, n=80; P=0.028). Stage classification was identified as the only significant factor which determined overall survival. Patients with KGF-positive tumors had significantly higher serum KGF levels compared with those who had KGF-negative tumors. Patients with K-sam‑positive tumors had significantly higher KGF levels compared with those who had K-sam-negative tumors. Pathological KGF expression was not significantly correlated with the degree of differentiation; however, there was a positive correlation between high K-sam expression in scirrhous gastric tumors and serum KGF levels. The present study revealed that high serum KGF levels are a risk factor for diffuse infiltrative gastric cancer and may provide a simple method of identifying patients with a poor prognosis among previously diagnosed preoperative gastric cancer patients.",GOF
28618942,"In the past decades, the oncogenic role of fibroblast growth factor receptor 2 has been demonstrated in a number of cancer types. However, studies have reported contradictory findings concerning the correlation between fibroblast growth factor receptor 2 expression and prognosis in solid tumors. To address this discrepancy, we performed a meta-analysis with 18 published studies (2975 patients) retrieved from PubMed, EMBASE, and Web of science. Data were extracted and computed into odds ratios. The results showed that fibroblast growth factor receptor 2 overexpression was significantly associated with decreased 3-year overall survival (odds ratio = 1.93, 95% confidence interval: 1.30-2.85, p = 0.001) and 5-year overall survival (odds ratio = 1.62, 95% confidence interval: 1.07-2.44, p = 0.02) in patients with solid tumors. Subgroup analysis revealed that high fibroblast growth factor receptor 2 expression was also associated with poor prognosis of gastric cancer, hepatocellular carcinoma, and esophageal cancer, but not correlated with pancreatic cancer. In conclusion, fibroblast growth factor receptor 2 overexpression is correlated with decreased survival in most solid tumors, suggesting that the expression status of fibroblast growth factor receptor 2 is a valuable prognostic biomarker and a novel therapeutic target in human solid tumors.",GOF
29358956,"MTG16 (myeloid translocation gene on chromosome 16) and its related proteins, MTG8 and MTGR1, define a small family of transcriptional corepressors. These corepressors share highly conserved domain structures yet have distinct biological functions and tissue specificity. In vivo studies have shown that, of the three MTG corepressors, MTG16 is uniquely important for the regulation of hematopoietic stem/progenitor cell (HSPC) proliferation and differentiation. Apart from this physiological function, MTG16 is also involved in carcinomas and leukemias, acting as the genetic target of loss of heterozygosity (LOH) aberrations in breast cancer and recurrent translocations in leukemia. The frequent involvement of MTG16 in these disease etiologies implies an important developmental role for this transcriptional corepressor. Furthermore, mounting evidence suggests that MTG16 indirectly alters the disease course of several leukemias via its regulatory interactions with a variety of pathologic fusion proteins. For example, a recent study has shown that MTG16 can repress not only wild-type E2A-mediated transcription, but also leukemia fusion protein E2A-Pbx1-mediated transcription, suggesting that MTG16 may serve as a potential therapeutic target in acute lymphoblastic leukemia expressing the E2A-Pbx1 fusion protein. Given that leukemia stem cells share similar regulatory pathways with normal HSPCs, studies to further understand how MTG16 regulates cell proliferation and differentiation could lead to novel therapeutic approaches for leukemia treatment.",GOF
30651846,"The exact cause instigating multiple myeloma (MM) has not been fully elucidated, and the disease has a median survival of 6 months without any treatment. To identify potential biomarkers of MM, serum proteins reflecting alteration in their proteomes were analyzed in 6 patients with MM compared with 6 healthy controls using two-dimensional electrophoresis (2-DE) and matrix-assisted laser desorption/ionization time-of flight mass spectrometry. The most notable differentially expressed proteins were validated by immunoblotting and changes in mRNA expression were evaluated by reverse transcription-quantitative polymerase chain reaction (RT-qPCR). A total of 11 differentially expressed protein spots were found. The expression levels of 7 proteins [Immunoglobulin heavy constant µ; proto-oncogene diffuse B-cell lymphoma (DBL2); 26S protease regulatory subunit 4 (P26s4); serum albumin; haptoglobin; and two unknown proteins with isoelectronic point (pI) of 6.41 and molecular weight of 35.4 kDa, and pI of 8.05 and molecular weight of 27.4 kDa, respectively] were downregulated in MM compared with healthy controls. Expression of gel actin-related protein 2/3 complex subunit 1A (ARPC1A); immunoglobulin heavy constant γ 1; fibrinogen α chain (FGA) fragment D; and zinc finger protein 70 were increased in serum of MM patients. Protein expressions of ARPC1A, FGA, P26s4 and DBL2 were measured by immunoblotting in an independent cohort of 12 MM patients and 10 healthy controls. RT-qPCR analysis demonstrated that ",GOF
30818239,"Environmental pollution occasioned by artisanal activities and technical failures at exploration sites has affected mostly oil producing and other mineral resources mining regions in developed and developing nations. As conventional techniques of remediation seem to be progressively unreliable and inefficient, contaminated land management experts have adopted a plant-based technology described as 'phytoremediation' for effective detoxification and removal of contaminants in substrate environmental media (soil and sediment). This technique, has gained public acceptance because of its aesthetic, eco-friendly, solar energy driven and low cost attributes. With complexity of environmental pollution in Africa, identification of appropriate remediation approach that deliver net environmental benefit and economic profit to the society is vital, while also focusing on the exploitation of plants genetic tools for more clarity on phyto tolerance, uptake and translocation of pollutants. In this article, we reviewed the status, progress and challenges of phytoremediation in selected African countries (South Africa, Nigeria, Tanzania, Zambia, Egypt and Ghana), the ecological impact of the pollutants, phytoremediation strategies and the possible plants of choice. Besides highlighting the support roles played by soil fauna and flora, the fate of harvested biomass/dieback and its future prospects are also discussed. We further explored the factors challenging phytoremediation progress in Africa, amidst its promising potentials and applicability for sustainable ecosystem management paradigm.",GOF
31416844,The use of selective BRAF inhibitors (BRAFi) has produced remarkable outcomes for patients with advanced cutaneous melanoma harboring a ,GOF
31530660,"Adopt a multidisciplinary approach to evaluate a virtually supervised home-based high-intensity interval training (Home-HIT) intervention in people with type 1 diabetes.
Eleven individuals with type 1 diabetes (seven women; age 30 ± 3 years; [Formula: see text] 2.5 ± 0.2 L/min; duration of diabetes 10 ± 2 years) completed 6 weeks of Home-HIT. A heart rate monitor and mobile phone application were used to provide feedback to the participants and research team on exercise intensity (compliance) and adherence.
Training adherence was 95 ± 2%, and compliance was 99 ± 1%. Home-HIT increased [Formula: see text] by 7% (
Virtually monitored Home-HIT resulted in high adherence alongside increased [Formula: see text] and decreased insulin dose.",GOF
31846234,"The combination of congenital bilateral perisylvian syndrome (CBPS) with lower motor neuron dysfunction remains unusual and suggests a potential common genetic insult affecting basic neurodevelopmental processes. Here we identify a putatively pathogenic missense mutation in the MCF2 gene in a boy with CBPS. Using in utero electroporation to genetically manipulate cortical neurons during corticogenesis, we demonstrate that the mouse Mcf2 gene controls the embryonic migration of cortical projection neurons. Strikingly, we find that the CBPS-associated MCF2 mutation impairs cortical laminar positioning, supporting the hypothesis that alterations in the process of embryonic neuronal migration can lead to rare cases of CBPS.",GOF
32004476,"Continual efferocytic clearance of apoptotic cells (ACs) by macrophages prevents necrosis and promotes injury resolution. How continual efferocytosis is promoted is not clear. Here, we show that the process is optimized by linking the metabolism of engulfed cargo from initial efferocytic events to subsequent rounds. We found that continual efferocytosis is enhanced by the metabolism of AC-derived arginine and ornithine to putrescine by macrophage arginase 1 (Arg1) and ornithine decarboxylase (ODC). Putrescine augments HuR-mediated stabilization of the mRNA encoding the GTP-exchange factor Dbl, which activates actin-regulating Rac1 to facilitate subsequent rounds of AC internalization. Inhibition of any step along this pathway after first-AC uptake suppresses second-AC internalization, whereas putrescine addition rescues this defect. Mice lacking myeloid Arg1 or ODC have defects in efferocytosis in vivo and in atherosclerosis regression, while treatment with putrescine promotes atherosclerosis resolution. Thus, macrophage metabolism of AC-derived metabolites allows for optimal continual efferocytosis and resolution of injury.",GOF
32553763,"Notch signaling maintains intestinal stem cells (ISCs). When ISCs exit the niche, Notch signaling among early progenitor cells at position +4/5 regulates their specification toward secretory vs enterocyte lineages (binary fate). The transcription factor ATOH1 is repressed by Notch in ISCs; its de-repression, when Notch is inactivated, drives progenitor cells to differentiate along the secretory lineage. However, it is not clear what promotes transition of ISCs to progenitors and how this fate decision is established.
We sorted cells from Lgr5-GFP knockin intestines from mice and characterized gene expression patterns. We analyzed Notch regulation by examining expression profiles (by quantitative reverse transcription polymerase chain reaction and RNAscope) of small intestinal organoids incubated with the Notch inhibitor DAPT, intestine tissues from mice given injections of the γ-secretase inhibitor dibenzazepine, and mice with intestine-specific disruption of Rbpj. We analyzed intestine tissues from mice with disruption of the RUNX1 translocation partner 1 gene (Runx1t1, also called Mtg8) or CBFA2/RUNX1 partner transcriptional co-repressor 3 (Cbfa2t3, also called Mtg16), and derived their organoids, by histology, immunohistochemistry, and RNA sequencing (RNA-seq). We performed chromatin immunoprecipitation and sequencing analyses of intestinal crypts to identify genes regulated by MTG16.
The transcription co-repressors MTG8 and MTG16 were highly expressed by +4/5 early progenitors, compared with other cells along crypt-villus axis. Expression of MTG8 and MTG16 were repressed by Notch signaling via ATOH1 in organoids and intestine tissues from mice. MTG8- and MTG16-knockout intestines had increased crypt hyperproliferation and expansion of ISCs, but enterocyte differentiation was impaired, based on loss of enterocyte markers and functions. Chromatin immunoprecipitation and sequencing analyses showed that MTG16 bound to promoters of genes that are specifically expressed by stem cells (such as Lgr5 and Ascl2) and repressed their transcription. MTG16 also bound to previously reported enhancer regions of genes regulated by ATOH1, including genes that encode Delta-like canonical Notch ligand and other secretory-specific transcription factors.
In intestine tissues of mice and human intestinal organoids, MTG8 and MTG16 repress transcription in the earliest progenitor cells to promote exit of ISCs from their niche (niche exit) and control the binary fate decision (secretory vs enterocyte lineage) by repressing genes regulated by ATOH1.",GOF
32870501,"MTG8 (RUNX1T1) is a fusion partner of AML1 (RUNX1) in the leukemic chromosome translocation t(8;21). The AML1-MTG8 fusion gene encodes a chimeric transcription factor. One of the highly conserved domains of MTG8 is TAFH which possesses homology with human TAF4 [TATA-box binding protein-associated factor]. To obtain specific inhibitors of the AML1-MTG8 fusion protein, we isolated RNA aptamers against the MTG8 TAFH domain using systematic evolution of ligands by exponential enrichment. All TAF aptamers contained guanine-rich sequences. Analyses of a TAF aptamer by NMR, CD, and mutagenesis revealed that it forms a parallel G-quadruplex structure in the presence of K",GOF
33293862,"Hepatocellular carcinoma (HCC) is one of the most devastating diseases worldwide. Limited performance of clinicopathologic parameters as prognostic factors underscores more accurate and effective biomarkers for high-confidence prognosis that guide decision-making for optimal treatment of HCC. The aim of the present study was to establish a novel panel to improve prognosis prediction of HCC patients, with a particular interest in transcription factors (TFs).
A TF-related prognosis model of liver cancer with data from ICGC-LIRP-JI cohort successively were processed by univariate and multivariate Cox regression analysis. Then, for evaluating the prognostic prediction value of the model, receiver operating characteristic (ROC) curve and survival analysis were performed both with internal data from the International Cancer Genome Consortium (ICGC) and external data from The Cancer Genome Atlas (TCGA). Furthermore, we verified the expression of three genes in HCC cell lines by Western blot and qPCR and protein expression level by IHC in liver cancer patients' sample. Finally, we constructed a TF clinical characteristics nomogram to furtherly predict liver cancer patient survival probability with TCGA cohort.
By Cox regression analysis, a panel of 15 TFs (
The 15-TF panel is an independent prognostic factor for HCC, and 15 TF-based nomogram might provide implication an effective approach for HCC patient management and treatment.",GOF
33405429,"DPC4 immunohistochemistry (IHC) is usually part of the work-up of mucinous neoplasms in the ovary where the distinction between an ovarian primary and metastatic pancreaticobiliary adenocarcinoma (PanACa) must be made. Although DPC4 IHC is lost in about 55% (46%-61%) of PanACas and typically retained in most primary ovarian mucinous neoplasms, no study has evaluated the expression of this marker in a large cohort of neoplasms arising in or involving gynecologic (GYN) organs. In this study, we retrospectively analyzed the expression of DPC4 IHC in a total of 251 tumors and lesions related to the GYN tract in which DPC4 IHC stain was performed during the initial pathology evaluation. Of these, 138 were primary GYN tumors and lesions, 31 were metastatic GYN tumors involving non-GYN sites, and 83 were metastatic non-GYN tumors involving the GYN tract. We identified 27 cases with loss of DPC4 IHC expression of which 20 cases met the inclusion criteria (i.e. clinical information was available to determine the site of tumor origin). We observed that loss of DPC4 nuclear expression was most commonly seen in tumors of endocervical origin (n=7), of which 5 were gastric-type cervical adenocarcinomas (GCxACa) and 2 were usual-type cervical adenocarcinomas, either primary or metastatic. This was followed by tumors of the pancreaticobiliary tract (n=5), ovary (n=2), and appendix (n=1). In addition, 1 gastric-type vaginal adenocarcinoma (GVaACa) also showed loss of DPC4. Our findings indicate that in female patients with mucinous neoplasms involving the ovary or other sites, with loss of DPC4 by IHC, and negative pancreaticobiliary imaging, the possibility of an occult GCx/GVaACa, and rarely an ovarian primary must be considered.",LOF
