pubmed_id,abstract,gene_type
35560009,"To determine whether the mechanotransduction and pharmacomanipulation of A-kinase anchoring protein 13 (AKAP13) altered Hippo signaling pathway transcription and growth factors in granulosa cells. Primary ovarian insufficiency is the depletion or dysfunction of primordial ovarian follicles. In vitro activation of ovarian tissue in patients with primary ovarian insufficiency alters the Hippo and phosphatase and tensin homolog/phosphatidylinositol 3-kinase/protein kinase B/forkhead box O3 pathways. A-kinase anchoring protein 13 is found in granulosa cells and may regulate the Hippo pathway via F-actin polymerization resulting in altered nuclear yes-associated protein (YAP)/transcriptional coactivator with PDZ-binding motif coactivators and Tea domain family (TEAD) transcription factors.
Laboratory studies.
Translational science laboratory.
None.
COV434 cells, derived from a primary human granulosa tumor cell line, were studied under different cell density and well stiffness conditions. Cells were transfected with a TEAD-luciferase (TEAD-luc) reporter as well as expression constructs for AKAP13 or AKAP13 mutants and then treated with AKAP13 activators, inhibitors, and follicle-stimulating hormone.
TEAD gene activation or inhibition was measured by TEAD-luciferase assays. The messenger ribonucleic acid levels of Hippo pathway signaling molecules, including connective tissue growth factor (CTGF), baculoviral inhibitors of apoptosis repeat-containing 5, Ankyrin repeat domain-containing protein 1, YAP1, and TEAD1, were measured by quantitative real-time polymerase chain reaction. Protein expressions for AKAP13, CTGF, YAP1, and TEAD1 were measured using Western blot.
Increased TEAD-luciferase activity and expression of markers for cellular growth were associated with decreased cell density, increased well stiffness, and AKAP13 activator (A02) treatment. Additionally, decreased TEAD-luc activity and expression of markers for cellular growth were associated with AKAP13 inhibitor (A13) treatment, including a reduced expression of the BIRC5 and ANKRD1 (YAP-responsive genes) transcript levels and CTGF protein levels. There were no changes in TEAD-luc with follicle-stimulating hormone treatment, supporting Hippo pathway involvement in the gonadotropin-independent portion of folliculogenesis.
These findings suggest that AKAP13 mediates Hippo-regulated changes in granulosa cell growth via mechanotransduction and pharmacomanipulation. The AKAP13 regulation of the Hippo pathway may represent a potential target for regulation of follicle activation.",GOF
35560280,"To determine if A-kinase anchoring protein 13 (AKAP13) interacts with the vitamin D receptor (VDR) to alter vitamin D-dependent signaling in fibroid cells. Uterine leiomyomas (fibroids) are characterized by a fibrotic extracellular matrix and are associated with vitamin D deficiency. Treatment with vitamin D (1,25-dihydroxyvitamin D
Laboratory studies.
Translational science laboratory.
Human immortalized fibroid or myometrial cells were treated with 1,25-hydroxyvitamin D
Messenger ribonucleic acid (mRNA) levels of AKAP13, fibromodulin, and versican as measured by quantitative real-time polymerase chain reaction. Glutathione S-transferase-binding assays. Vitamin D-dependent gene activation as measured by luciferase assays.
1,25(OH)
These data suggest that AKAP13 inhibited the vitamin D receptor activation by a mechanism that required, at least in part, RhoA activation.",GOF
35562412,"In the latest 2016 World Health Organization classification of hematological malignancies, T-cell lymphoblastic lymphoma (T-LBL) and lymphoblastic leukemia (T-ALL) are grouped together into one entity called T-cell lymphoblastic leukemia/lymphoma (T-LBLL). However, the question of whether these entities represent one or two diseases remains. Multiple studies on driver alterations in T-ALL have led to a better understanding of the disease while, so far, little data on genetic profiles in T-LBL is available. We sought to define recurrent genetic alterations in T-LBL and provide a comprehensive comparison with T-ALL. Targeted whole-exome next-generation sequencing of 105 genes, multiplex ligation-dependent probe amplification, and quantitative PCR allowed comprehensive genotype assessment in 818, consecutive, unselected, newly diagnosed patients (342 T-LBL vs. 476 T-ALL). The median age at diagnosis was similar in T-LBL and T-ALL (17 vs. 15 years old, respectively; p = 0.2). Although we found commonly altered signaling pathways and co-occurring mutations, we identified recurrent dissimilarities in actionable gene alterations in T-LBL as compared to T-ALL. HOX abnormalities (TLX1 and TLX3 overexpression) were more frequent in T-ALL (5% of T-LBL vs 13% of T-ALL had TLX1 overexpression; p = 0.04 and 6% of T-LBL vs 17% of T-ALL had TLX3 overexpression; p = 0.006). The PI3K signaling pathway was significantly more frequently altered in T-LBL as compared to T-ALL (33% vs 19%; p < 0.001), especially through PIK3CA alterations (9% vs 2%; p < 0.001) with PIK3CA",GOF
35562965,"RNA sequencing provides a snapshot of the functional consequences of genomic lesions that drive acute lymphoblastic leukemia (ALL). The aims of this study were to elucidate diagnostic associations (via machine learning) between mRNA-seq profiles, independently verify ALL lesions and develop easy-to-interpret transcriptome-wide biomarkers for ALL subtyping in the clinical setting. A training dataset of 1279 ALL patients from six North American cohorts was used for developing machine learning models. Results were validated in 767 patients from Australia with a quality control dataset across 31 tissues from 1160 non-ALL donors. A novel batch correction method was introduced and applied to adjust for cohort differences. Out of 18,503 genes with usable expression, 11,830 (64%) were confounded by cohort effects and excluded. Six ALL subtypes (ETV6::RUNX1, KMT2A, DUX4, PAX5 P80R, TCF3::PBX1, ZNF384) that covered 32% of patients were robustly detected by mRNA-seq (positive predictive value ≥ 87%). Five other frequent subtypes (CRLF2, hypodiploid, hyperdiploid, PAX5 alterations and Ph-positive) were distinguishable in 40% of patients at lower accuracy (52% ≤ positive predictive value ≤ 73%). Based on these findings, we introduce the Allspice R package to predict ALL subtypes and driver genes from unadjusted mRNA-seq read counts as encountered in real-world settings. Two examples of Allspice applied to previously unseen ALL patient samples with atypical lesions are included.",GOF
35563178,"DEK and miR-5100 play critical roles in many steps of cancer initiation and progression and are directly or indirectly regulated by most promoters and repressors. LEF1-AS1 as a long non-coding RNA can regulate tumor development through sponge miRNA. The effect and regulatory mechanism of DEK on autophagy and apoptosis in gastric cancer (GC), and the role between miR-5100 and DEK or miR-5100 and LEF1-AS1 are still unclear. Our study found that DEK was highly expressed in gastric cancer tissues and cell lines, and knockdown of DEK inhibited the autophagy of cells, promoted apoptosis, and suppressed the malignant phenotype of gastric cancer. DEK regulates autophagy and apoptosis through the AMPK/mTOR signaling pathway. In addition, miR-5100 inhibits autophagy and promotes apoptosis in GC cells while LEF1-AS1 had the opposite effect. Studies have shown that miR-5100 acts by targeting the 3'UTR of DEK, and LEF1-AS1 regulates the expression of miR-5100 by sponging with mIR-5100. In conclusion, our results found that LEF1-AS1 and miR-5100 sponge function, and the miR-5100/DEK/AMPK/mTOR axis regulates autophagy and apoptosis in gastric cancer cells.",GOF
35563322,The B-cell CLL/lymphoma 11B gene ,GOF
35565295,Retinoblastoma is a tumor of the eye in children under the age of five caused by biallelic inactivation of the ,GOF
35567571,"The DNA damage response (DDR) represents a complex network of proteins which detect and repair DNA damage, thereby maintaining the integrity of the genome and preventing the transmission of mutations and rearranged chromosomes to daughter cells. Faults in the DDR are a known driver and hallmark of cancer. Furthermore, inhibition of DDR enzymes can be used to treat the disease. This is exemplified by PARP inhibitors (PARPi) used to treat cancers with defects in the homologous recombination DDR pathway. A series of novel DDR targets are now also under pre-clinical or clinical investigation, including inhibitors of ATR kinase, WRN helicase or the DNA polymerase/helicase Polθ (Pol-Theta). Drug resistance is a common phenomenon that impairs the overall effectiveness of cancer treatments and there is already some understanding of how resistance to PARPi occurs. Here, we discuss how an understanding of PARPi resistance could inform how resistance to new drugs targeting the DDR emerges. We also discuss potential strategies that could limit the impact of these therapy resistance mechanisms in cancer.",LOF
35568199,"Long-term activation of inositol 1,4,5-trisphosphate receptors (IP",GOF
35568723,"Blood-brain barrier (BBB) dysfunction has been recognized as an early pathological feature and contributing factor in multiple sclerosis. Endothelial-to-mesenchymal transition is a process associated with endothelial dysfunction leading to the disruption of vessel stability and barrier function, yet its functional consequence in multiple sclerosis remains unclear. Here, we demonstrated that endothelial-to-mesenchymal transition accompanied the blood-brain barrier dysfunction in several neurological disorders, especially in multiple sclerosis. The activity of transcription factor ETS1, which is highly expressed in endothelial cells (ECs) and responded to an inflammatory condition, is suppressed in the central nervous system (CNS) ECs in MS and its animal model experimental autoimmune encephalomyelitis. We identify ETS1 as a central regulator of endothelial-to-mesenchymal transition (EndMT) associated with the compromise of barrier integrity. These phenotypical and functional alterations can further induce high permeability, immune infiltration, and organ fibrosis in multiple sclerosis, thus promoting disease progression. Together, these results demonstrate a functional role of EndMT in blood-brain barrier dysfunction and propose ETS1 as a potential transcriptional switch of EndMT to target the development of multiple sclerosis.",GOF
35568774,"Triple-negative breast cancer lacks an expression of ER, PR, and Her-2, has a poor prognosis, and there are no target therapies available. Therapeutic options to treat TNBC are limited and urgently needed. Strong evidence indicates that molecular signaling pathways have a significant function to regulate biological mechanisms and their abnormal expression endows with the development of cancer. PIM kinase is overexpressed in various human cancers including TNBC which is regulated by various signaling pathways that are crucial for cancer cell proliferation and survival and also make PIM kinase as an attractive drug target. One of the targets of the STAT3 signaling pathway is PIM1 that plays a key role in tumor progression and transformation. In this review, we accumulate the current scenario of the PIM-STAT3 axis that provides insights into the PIM1 and STAT3 inhibitors which can be developed as potential co-inhibitors as prospective anticancer agents.",GOF
35569185,"Thrombocytopenia (TP) remains a challenge in clinical hematology. TP may have serious consequences, such as recurrent skin and mucosal bleeding and increased risk of intracranial and internal organ hemorrhage. However, effective and safe therapeutic drugs for the long-term management of TP are still lacking.
This study aimed to identify more effective active compounds for TP therapy.
Liquid chromatography-mass spectrometry-nuclear magnetic resonance analysis was used to confirm the medicinal species and chemical structure of Hirsutine (HS). The proliferation of HS was examined by Cell Counting Kit (CCK-8) assay on cells lines. The effect of HS on megakaryocyte differentiation was analyzed by evaluating the expression of CD41, CD42b, and DNA ploidy via flow cytometry (FCM). The morphology of megakaryocytes and intermediate cells was observed using an optical microscope. K562 cells were then stained with Giemsa and benzidine. qRT-PCR was used to examine the mRNA expression of GATA-1, GATA-2, FOG-1, TAL-1, RUNX-1, NF-E2, and KLF-1 in K562 cells. Protein levels of the transcription factors were analyzed by western blotting. An MEK inhibitor was used to verify the relationship between the MEK/ERK signaling pathway and CD41/CD42b (FCM), FOG-1, and TAL-1. The Kunming thrombocytopenia mouse model was established by X-ray irradiation (4 Gy) and used to test HS activity and related hematopoietic organ index in vivo. Finally, computer simulations of molecular docking were used to predict the binding energies between HS-MEK and HS-ERK.
We preliminarily identified HS by screening a plant-sourced compound library for natural compounds with megakaryocytic differentiation and maturation (MKD/MKM)-promoting activity. We found that HS not only enhanced MKD/MKM of K562 and Meg01 cells, but also suppressed the decline of peripheral platelet levels in X-ray-induced myelosuppressive mice. In addition, HS promoted MKD via activation of MEK-ERK-FOG1/TAL1 signaling, which may be the key molecular mechanism of HS action in TP treatment. Molecular docking simulations further verified that HS targets the signaling protein MEK with high-affinity.
In this study, we report for the first time that hirsutine boosts MKD/MKM through the MEK/ERK/FOG1/TAL1 signaling pathway and thus represents a promising treatment option for TP.",GOF
35570134,"With the advent of next-generation sequencing (NGS), monogenic forms of common variable immunodeficiency (CVID) have been increasingly described. Our study aimed to identify disease-causing variants in a Western Australian CVID cohort using a novel targeted NGS panel. Targeted amplicon NGS was performed on 22 unrelated subjects who met the formal European Society for Immunodeficiencies-Pan-American Group for Immunodeficiency diagnostic criteria for CVID and had at least one of the following additional criteria: disease onset at age <18 years, autoimmunity, low memory B lymphocytes, family history, and/or history of lymphoproliferation. Candidate variants were assessed by in silico predictions of deleteriousness, comparison to the literature, and classified according to the American College of Medical Genetics and Genomics-Association for Molecular Pathology criteria. All detected genetic variants were verified independently by an external laboratory, and additional functional studies were performed if required. Pathogenic or likely pathogenic variants were detected in 6 of 22 (27%) patients. Monoallelic variants of uncertain significance were also identified in a further 4 of 22 patients (18%). Pathogenic variants, likely pathogenic variants, or variants of uncertain significance were found in TNFRSF13B, TNFRSF13C, ICOS, AICDA, IL21R, NFKB2, and CD40LG, including novel variants and variants with unexpected inheritance pattern. Targeted amplicon NGS is an effective tool to identify monogenic disease-causing variants in CVID, and is comparable or superior to other NGS methods. Moreover, targeted amplicon NGS identified patients who may benefit from targeted therapeutic strategies and had important implications for family members.",GOF
35572767,The methylotrophic yeast ,GOF
35572917,Acute promyelocytic leukemia (APL) is a unique leukemia that is characterized by the ,GOF
35576719,"Psoriasis is a chronic dermal inflammatory disease with a world-wide prevalence in which different immune/non-immune cells, e.g. T cells, macrophages, neutrophils, and keratinocytes play a decisive role. These immune cells interact among themselves by releasing multiple mediators which eventually cause characteristic psoriatic plaques in the skin. T cells are reported to be significant contributors to psoriatic inflammation through release of multiple cytokines which are controlled by several kinases, one of them being Lymphocyte-specific protein tyrosine kinase (Lck). Lck has been reported to be crucial for expression/production of several key inflammatory cytokines though modulation of several other kinases/transcription factors in T cells. Therefore, in this investigation, effect of Lck inhibitor, A-770041 was examined on PLCγ, p38MAPK, NFATc1, NFkB and STAT3, TNF-α, IFN-γ, Foxp3, IL-17A, in CD4+ T cells in imiquimod (IMQ)-induced psoriatic inflammation in mice. Results from the present study exhibit that p-Lck expression is enhanced in CD4+ T cells of IMQ-treated mice which is concomitant with enhanced clinical features of psoriatic inflammation (ear/back skin thickness, MPO activity, acanthosis/leukocytic infiltration) and molecular parameters (enhanced expression of p-Lck, p-PLCγ, p-p38-MAPK, NFATc1, p-NFkB, TNF-α, IFN-γ, p-STAT3, and IL-17A in CD4+ T cells). Inhibition of Lck signaling led to amelioration of clinical features of psoriasis through attenuation of Th1/Th17 immune responses and upregulation of Treg cells in IMQ-treated mice. In summary, current investigations reveal that Lck signaling is a crucial executor of inflammatory signaling in CD4+ T cells in the context of psoriatic inflammation. Therefore, Lck inhibition may be pursued as an effective strategy to counteract psoriatic inflammation.",GOF
35581421,"Lysine demethylase 5A (KDM5A) is a histone demethylase frequently involved in cancer progression. This research aimed to explore the function of KDM5A in prostate adenocarcinoma (PRAD) and the molecular mechanism. KDM5A was highly expressed in collected PRAD tissues and acquired PRAD cells. High KDM5A expression was correlated with reduced survival and poor prognosis of patients with PRAD. Knockdown of KDM5A suppressed the proliferation, colony formation, migration, and invasiveness of PRAD cells and reduced angiogenesis ability of endothelial cells. Downstream molecules implicated in KDM5A mediation were predicted using integrated bioinformatic analyses. KDM5A enhanced ETS proto-oncogene 1 (ETS1) expression through demethylation of H3K4me2 at its promoter. ETS1 suppressed the transcription activity of miR-330-3p, and either further ETS1 overexpression or miR-330-3p inhibition blocked the functions of KDM5A knockdown in PRAD. miR-330-3p targeted coatomer protein complex subunit β2 (COPB2) mRNA. Downregulation of miR-330-3p restored the expression of COPB2 and activated the PI3K/AKT pathway in PRAD. The results in vitro were reproduced in vivo where KDM5A downregulation suppressed the growth and metastasis of xenograft tumors in nude mice. In conclusion, this study demonstrated that KDM5A promoted PRAD by suppressing miR-330-3p and activating the COPB2/PI3K/AKT axis in an ETS1-dependent manner.",GOF
35582959,"Mutation in Werner (WRN) RECQL helicase is associated with premature aging syndrome (Werner syndrome, WS) and predisposition to multiple cancers. In patients with solid cancers, deficiency of the WRN RECQL helicase is paradoxically associated with enhanced overall survival in response to treatment with TOP1 inhibitors, which stabilize pathological TOP1-DNA-covalent-complexes (TOP1cc) on the genome. However, the underlying mechanism of WRN in development of chemoresistance to TOP1 inhibitors is not yet explored. Our whole-genome transcriptomic analysis for ~25,000 genes showed robust activation of NF-κB-dependent prosurvival genes in response to TOP1cc. CRISPR-Cas9 knockout, shRNA silencing, and under-expression of WRN confer high-sensitivity of multiple cancers to TOP1 inhibitor. We demonstrated that WRN orchestrates TOP1cc repair through proteasome-dependent and proteasome-independent process, unleashing robust ssDNA generation. This in turn ensues signal transduction for CHK1 mediated NF-κB-activation through IκBα-degradation and nuclear localization of p65 protein. Intriguingly, our site-directed mutagenesis and rescue experiments revealed that neither RECQL-helicase nor DNA-exonuclease enzyme activity of WRN (WRN",LOF
35585803,"Autosomal dominant polycystic kidney disease (ADPKD) may coexist with other genetic disorders, such as tuberous sclerosis, when deletion in TSC2/PKD1 genes occurs. Recently, the effect of tolvaptan has been explored in ADPKD patients alone, but its safety and efficacy on TSC2/PKD1 contiguous gene syndrome is unknown.
This report describes the case of an asymptomatic patient with TSC2/PKD1 contiguous gene syndrome that fulfills the imaging criteria for initiating the treatment with tolvaptan. After twelve months, the patient did not exhibit severe adverse effects and blood pressure control improved.
In this TSC2/PKD1 contiguous gene syndrome single case report, tolvaptan was safe and well-tolerated. More extensive experimental studies are needed to deeply understand the therapeutic implications of vasopressin V2-receptor inhibition in the TSC2/PKD1 contiguous gene syndrome patients.",GOF
35585913,"In the past one or two decades, countries across the world have successively implemented different precision medicine (PM) programs, and also cooperated to implement international PM programs. We are now in the era of PM. Singapore's National Precision Medicine (NPM) program, initiated in 2017, is now entering its second phase to generate a large genomic database for Asians. The National University of Singapore (NUS) also launched its own PM translational research program (TRP) in 2021, aimed at consolidating multidisciplinary expertise within the Yong Loo Lin School of Medicine to develop collaborative projects that can help to identify and validate novel therapeutic targets for the realization of PM. To achieve this, appropriate data collection, data processing, and results interpretation must be taken into consideration. There may be some difficulties during these processes, but with the improvement of relevant rules and the continuous development of omics-based technologies, we will be able to solve these problems, eventually achieving precise prediction, diagnosis, treatment, or even prevention of diseases.",GOF
35586626,"Primary hyperparathyroidism (PHPT) is characterized by overproduction of parathyroid hormone and subsequent hypercalcemia. Approximately 10% of PHPT cases are hereditary, and several genes, such as ",LOF
35587097,"We recently reported an RAF rearrangement without NRAS or BRAF mutations in lesions from Giant Congenital Melanocytic Nevi (CMN). The new gene fusion involves the 5'-end of the promoter-containing N terminus of the SOX5 gene fused to exons 7-16 of the 3'-end of RAF1 gene leading to a SOX5-RAF1 fusion transcript which loses the auto-inhibitory CR1 domain but retains the complete in-frame coding sequence for the C-Terminal kinase domain of the RAF1. Stable expression of SOX5-RAF1 fusion induced growth factor-independent cell growth in murine hematopoietic Ba/F3 cells and melan-a immortalized melanocytes. Besides, it led to the transformation of both Ba/F3 and NIH 3T3 cells as revealed by colony formation assays. Furthermore, its expression results in MAPK activation assessed by increased levels of p-ERK protein in the cytosol of transduced cells. Treatment with Sorafenib and UO126 inhibited proliferation of Ba/F3-SOX5-RAF1 cells in the absence of IL3 but not the PLX 4720, a specific inhibitor of BRAF. Moreover, the tumorigenic and metastatic capacities of SOX5-RAF1 were assessed in vivo. These results indicate that SOX5-RAF1, a driver event for CMN development, has oncogenic capacity. Thus, sequencing of CMN transcriptomes may lead to the identification of this druggable fusion and interfere with the progression toward melanoma.",GOF
35587604,"Transcriptional factor 3 (TCF3, also termed E2A), first reported to exert crucial functions during lymphocyte development, has been revealed to participate in the pathogenesis of human cancers. The aim of this work was to investigate the function of TCF3 in cervical cancer (CC) and the molecular interactions. The bioinformatics prediction suggested that TCF3 was highly expressed in CC and linked to poor prognosis. Increased TCF3 expression was identified in CC cell lines, and its downregulation reduced proliferation and migration of CC cells ",GOF
35591843,,LOF
